tcpdump -n -i eth0
21:07:55.086975 IP 138.197.170.55.22 > 198.96.84.204.56339: Flags [P.], seq 758656:758812, ack 397, win 313, length 156
21:07:55.087097 IP 138.197.170.55.22 > 198.96.84.204.56339: Flags [P.], seq 758812:758968, ack 397, win 313, length 156
21:07:55.087226 IP 138.197.170.55.22 > 198.96.84.204.56339: Flags [P.], seq 758968:759124, ack 397, win 313, length 156
21:07:55.087353 IP 138.197.170.55.22 > 198.96.84.204.56339: Flags [P.], seq 759124:759280, ack 397, win 313, length 156
21:07:55.087476 IP 138.197.170.55.22 > 198.96.84.204.56339: Flags [P.], seq 759280:759436, ack 397, win 313, length 156
21:07:55.087581 IP 138.197.170.55.22 > 198.96.84.204.56339: Flags [P.], seq 759436:759592, ack 397, win 313, length 156
21:07:55.087680 IP 138.197.170.55.22 > 198.96.84.204.56339: Flags [P.], seq 759592:759748, ack 397, win 313, length 156
21:07:55.087777 IP 138.197.170.55.22 > 198.96.84.204.56339: Flags [P.], seq 759748:759904, ack 397, win 313, length 156
21:07:55.087905 IP 138.197.170.55.22 > 198.96.84.204.56339: Flags [P.], seq 759904:760060, ack 397, win 313, length 156
21:07:55.088042 IP 138.197.170.55.22 > 198.96.84.204.56339: Flags [P.], seq 760060:760216, ack 397, win 313, length 156
21:07:55.088153 IP 138.197.170.55.22 > 198.96.84.204.56339: Flags [P.], seq 760216:760372, ack 397, win 313, length 156
21:07:55.088277 IP 138.197.170.55.22 > 198.96.84.204.56339: Flags [P.], seq 760372:760528, ack 397, win 313, length 156
21:07:55.088426 IP 138.197.170.55.22 > 198.96.84.204.56339: Flags [P.], seq 760528:760684, ack 397, win 313, length 156
21:07:55.088579 IP 138.197.170.55.22 > 198.96.84.204.56339: Flags [P.], seq 760684:760840, ack 397, win 313, length 156
21:07:55.088626 IP 198.96.84.204.56339 > 138.197.170.55.22: Flags [.], ack 756992, win 512, length 0
21:07:55.088786 IP 138.197.170.55.22 > 198.96.84.204.56339: Flags [P.], seq 760840:761100, ack 397, win 313, length 260
21:07:55.088911 IP 138.197.170.55.22 > 198.96.84.204.56339: Flags [P.], seq 761100:761256, ack 397, win 313, length 156
21:07:55.089044 IP 138.197.170.55.22 > 198.96.84.204.56339: Flags [P.], seq 761256:761412, ack 397, win 313, length 156
21:07:55.089170 IP 138.197.170.55.22 > 198.96.84.204.56339: Flags [P.], seq 761412:761568, ack 397, win 313, length 156
21:07:55.089275 IP 138.197.170.55.22 > 198.96.84.204.56339: Flags [P.], seq 761568:761724, ack 397, win 313, length 156
21:07:55.089374 IP 138.197.170.55.22 > 198.96.84.204.56339: Flags [P.], seq 761724:761880, ack 397, win 313, length 156
21:07:55.089464 IP 198.96.84.204.56339 > 138.197.170.55.22: Flags [.], ack 758032, win 508, length 0
21:07:55.089481 IP 198.96.84.204.56339 > 138.197.170.55.22: Flags [.], ack 758500, win 512, length 0
21:07:55.089594 IP 138.197.170.55.22 > 198.96.84.204.56339: Flags [P.], seq 761880:762244, ack 397, win 313, length 364
21:07:55.089734 IP 198.96.84.204.56339 > 138.197.170.55.22: Flags [.], ack 759592, win 508, length 0
21:07:55.089746 IP 138.197.170.55.22 > 198.96.84.204.56339: Flags [P.], seq 762244:762400, ack 397, win 313, length 156
21:07:55.089921 IP 138.197.170.55.22 > 198.96.84.204.56339: Flags [P.], seq 762400:762660, ack 397, win 313, length 260
21:07:55.090081 IP 138.197.170.55.22 > 198.96.84.204.56339: Flags [P.], seq 762660:762816, ack 397, win 313, length 156
21:07:55.090186 IP 138.197.170.55.22 > 198.96.84.204.56339: Flags [P.], seq 762816:762972, ack 397, win 313, length 156
21:07:55.090290 IP 138.197.170.55.22 > 198.96.84.204.56339: Flags [P.], seq 762972:763128, ack 397, win 313, length 156
21:07:55.090401 IP 138.197.170.55.22 > 198.96.84.204.56339: Flags [P.], seq 763128:763284, ack 397, win 313, length 156
21:07:55.090526 IP 138.197.170.55.22 > 198.96.84.204.56339: Flags [P.], seq 763284:763440, ack 397, win 313, length 156
21:07:55.090643 IP 138.197.170.55.22 > 198.96.84.204.56339: Flags [P.], seq 763440:763596, ack 397, win 313, length 156
21:07:55.090778 IP 138.197.170.55.22 > 198.96.84.204.56339: Flags [P.], seq 763596:763752, ack 397, win 313, length 156
21:07:55.090913 IP 138.197.170.55.22 > 198.96.84.204.56339: Flags [P.], seq 763752:763908, ack 397, win 313, length 156
21:07:55.091089 IP 138.197.170.55.22 > 198.96.84.204.56339: Flags [P.], seq 763908:764064, ack 397, win 313, length 156
21:07:55.091211 IP 138.197.170.55.22 > 198.96.84.204.56339: Flags [P.], seq 764064:764220, ack 397, win 313, length 156
21:07:55.091363 IP 138.197.170.55.22 > 198.96.84.204.56339: Flags [P.], seq 764220:764376, ack 397, win 313, length 156
21:07:55.091517 IP 138.197.170.55.22 > 198.96.84.204.56339: Flags [P.], seq 764376:764532, ack 397, win 313, length 156
21:07:55.091668 IP 138.197.170.55.22 > 198.96.84.204.56339: Flags [P.], seq 764532:764688, ack 397, win 313, length 156
21:07:55.091785 IP 198.96.84.204.56339 > 138.197.170.55.22: Flags [.], ack 762400, win 512, length 0
21:07:55.091877 IP 138.197.170.55.22 > 198.96.84.204.56339: Flags [P.], seq 764688:764844, ack 397, win 313, length 156
21:07:55.092012 IP 138.197.170.55.22 > 198.96.84.204.56339: Flags [P.], seq 764844:765104, ack 397, win 313, length 260
21:07:55.092254 IP 138.197.170.55.22 > 198.96.84.204.56339: Flags [P.], seq 765104:765260, ack 397, win 313, length 156
21:07:55.092432 IP 138.197.170.55.22 > 198.96.84.204.56339: Flags [P.], seq 765260:765416, ack 397, win 313, length 156
21:07:55.092601 IP 138.197.170.55.22 > 198.96.84.204.56339: Flags [P.], seq 765416:765572, ack 397, win 313, length 156
21:07:55.092711 IP 198.96.84.204.56339 > 138.197.170.55.22: Flags [P.], seq 397:433, ack 762400, win 512, length 36
